{
  "id": 1701,
  "page": 1,
  "results": [
    {
      "adult": false,
      "backdrop_path": "/3CxUndGhUcZdt1Zggjdb2HkLLQX.jpg",
      "genre_ids": [
        28
      ],
      "id": 640146,
      "original_language": "en",
      "original_title": "Ant-Man and the Wasp: Quantumania",
      "overview": "Das Superhelden-Duo Scott Lang und Hope Van Dyne erkundet zusammen mit Hopes Eltern Hank Pym und Janet Van Dyne das Quantenreich, interagiert mit seltsamen neuen Kreaturen und begibt sich auf ein Abenteuer, das sie \u00fcber die Grenzen dessen hinaustreiben wird, was sie f\u00fcr m\u00f6glich gehalten haben.",
      "popularity": 9200.005,
      "poster_path": "/nA5otwVxAfpBP4PVgeuBk3qHcLY.jpg",
      "release_date": "2023-02-15",
      "title": "Ant-Man and the Wasp: Quantumania",
      "video": false,
      "vote_average": 6.5,
      "vote_count": 2079
    }
  ],
  "total_pages": 11,
  "total_results": 211
}