{
  "id": 1399,
  "page": 1,
  "results": [
    {
      "description": "",
      "favorite_count": 0,
      "id": 8257231,
      "item_count": 182,
      "iso_639_1": "en",
      "iso_3166_1": "US",
      "name": "Done",
      "poster_path": {}
    }
  ],
  "total_pages": 96,
  "total_results": 1906
}